{
  "schema": "joat.production_lesson.v1",
  "file_version": "1.0.0",
  "id": "role-voice_dialogue",
  "status": "approved",
  "roles": [
    "voice_dialogue"
  ],
  "scope": {
    "project_id": null,
    "style_id": null
  },
  "title": "Voice Dialogue guidance",
  "guidance": "Distinguish CPU narration, supplied speech and native visible actor dialogue. Preserve exact words and stable intended voices across shots. Qualify perceptual and phoneme timing; ASR alone does not validate lip sync.",
  "review": {
    "reviewer": "Codex under owner-approved audit implementation",
    "approval_basis": "Owner approved the read-only audit recommendations on 2026-10-18; guidance preserves existing authorities, not creative or spending grants."
  },
  "evidence": [
    {
      "source": "docs/JOAT_STUDIO_AUDIT_v1.0.0.md",
      "sha256": "ba11d3ed7565faf23edfebef6b56837b2f718a4e493bfc515fbc2db5705b502f"
    }
  ],
  "valid_from": "2026-10-18T00:00:00Z",
  "expires_at": "2027-01-18T00:00:00Z",
  "versions": {},
  "supersedes": []
}
