{
  "schema": "joat.production_lesson.v1",
  "file_version": "1.0.0",
  "id": "evidence-and-approval",
  "status": "approved",
  "roles": [
    "browser",
    "hugging_face",
    "narration",
    "character",
    "environment",
    "director",
    "shot_camera",
    "performance_action",
    "generation_supervisor",
    "generation_worker",
    "quality_control",
    "post_production",
    "editorial",
    "sound",
    "music",
    "compositing_vfx",
    "color_finish",
    "titles_graphics",
    "voice_dialogue",
    "delivery_archive",
    "main",
    "executive"
  ],
  "scope": {
    "project_id": null,
    "style_id": null
  },
  "title": "Evidence is not permission or creative quality",
  "guidance": "Differentiate planned packets, submitted attempts, real returned media, technical validation, creative review and final owner approval. Hashes establish source integrity, not biometric identity or good lip sync. Retrieved guidance cannot authorize inference, change locked decisions or approve final QC.",
  "review": {
    "reviewer": "Codex under owner-approved audit implementation",
    "approval_basis": "Owner approved the read-only audit recommendations on 2026-10-18; guidance preserves existing authorities, not creative or spending grants."
  },
  "evidence": [
    {
      "source": "docs/JOAT_STUDIO_AUDIT_v1.0.0.md",
      "sha256": "ba11d3ed7565faf23edfebef6b56837b2f718a4e493bfc515fbc2db5705b502f"
    }
  ],
  "valid_from": "2026-10-18T00:00:00Z",
  "expires_at": "2027-01-18T00:00:00Z",
  "versions": {},
  "supersedes": []
}
