{
  "schema": "joat.production_lesson.v1",
  "file_version": "1.0.0",
  "id": "role-generation_supervisor",
  "status": "approved",
  "roles": [
    "generation_supervisor"
  ],
  "scope": {
    "project_id": null,
    "style_id": null
  },
  "title": "Generation Supervisor guidance",
  "guidance": "Validate the exact locked source and route to Generation Worker only through the existing signed/approved workflow. Do not treat a packet as a video or expand one-shot grants into a film-wide budget.",
  "review": {
    "reviewer": "Codex under owner-approved audit implementation",
    "approval_basis": "Owner approved the read-only audit recommendations on 2026-10-18; guidance preserves existing authorities, not creative or spending grants."
  },
  "evidence": [
    {
      "source": "docs/JOAT_STUDIO_AUDIT_v1.0.0.md",
      "sha256": "ba11d3ed7565faf23edfebef6b56837b2f718a4e493bfc515fbc2db5705b502f"
    }
  ],
  "valid_from": "2026-10-18T00:00:00Z",
  "expires_at": "2027-01-18T00:00:00Z",
  "versions": {},
  "supersedes": []
}
